{"canonicalization":"wordpress-hx.canonical-json.v1","files":[{"contentSha256":"61c812c19556226058aba89d2dc6a2fb14eebf756acbf25229e8db87bb30cab0","kind":"adoption.generated","ownerNodeId":"adoption/acme-calendar","path":"generated/adoption/acme-calendar/adoption.bundle.json","projectionIds":["adoption/acme-calendar/bundle"],"rootId":"generated","sizeBytes":1290,"sourceNodeIds":["adoption/acme-calendar/provider-inputs"],"sourceSpans":[{"end":{"column":1,"line":1255,"offset":46439},"path":"scripts/adoption/generate-fixture.py","sourceSha256":"5cc9d0a8c0ba440888de5a06d899002ce83bfe8fa03c752e0d6e8d21476de58b","start":{"column":1,"line":1,"offset":0},"symbol":"write_documents"}],"validatorIds":["adoption.bundle"]},{"contentSha256":"1334089a8a3cbd7826691e8cf24df0c3349e492880bc27dc018c20f8aa09eb24","kind":"adoption.generated","ownerNodeId":"adoption/acme-calendar","path":"generated/adoption/acme-calendar/browser/acme-calendar-facade.mjs","projectionIds":["adoption/acme-calendar/bundle"],"rootId":"generated","sizeBytes":6177,"sourceNodeIds":["adoption/acme-calendar/provider-inputs"],"sourceSpans":[{"end":{"column":1,"line":1255,"offset":46439},"path":"scripts/adoption/generate-fixture.py","sourceSha256":"5cc9d0a8c0ba440888de5a06d899002ce83bfe8fa03c752e0d6e8d21476de58b","start":{"column":1,"line":1,"offset":0},"symbol":"write_documents"}],"validatorIds":["adoption.bundle"]},{"contentSha256":"aede759e0bfc8948b0e086452343a1254963b4ef67d77143571d584ad4c0b6fd","kind":"adoption.generated","ownerNodeId":"adoption/acme-calendar","path":"generated/adoption/acme-calendar/capability.json","projectionIds":["adoption/acme-calendar/bundle"],"rootId":"generated","sizeBytes":2477,"sourceNodeIds":["adoption/acme-calendar/provider-inputs"],"sourceSpans":[{"end":{"column":1,"line":1255,"offset":46439},"path":"scripts/adoption/generate-fixture.py","sourceSha256":"5cc9d0a8c0ba440888de5a06d899002ce83bfe8fa03c752e0d6e8d21476de58b","start":{"column":1,"line":1,"offset":0},"symbol":"write_documents"}],"validatorIds":["adoption.bundle"]},{"contentSha256":"6d194c5a5a3688c51b23a543b26e499aba9faf1af6cecd2c59f01ee76719e74e","kind":"adoption.generated","ownerNodeId":"adoption/acme-calendar","path":"generated/adoption/acme-calendar/contract.json","projectionIds":["adoption/acme-calendar/bundle"],"rootId":"generated","sizeBytes":8278,"sourceNodeIds":["adoption/acme-calendar/provider-inputs"],"sourceSpans":[{"end":{"column":1,"line":1255,"offset":46439},"path":"scripts/adoption/generate-fixture.py","sourceSha256":"5cc9d0a8c0ba440888de5a06d899002ce83bfe8fa03c752e0d6e8d21476de58b","start":{"column":1,"line":1,"offset":0},"symbol":"write_documents"}],"validatorIds":["adoption.bundle"]},{"contentSha256":"59c4729d6606960a318c6517e912fb000892ffe5e26ea23d5a40fc2e38274b35","kind":"adoption.generated","ownerNodeId":"adoption/acme-calendar","path":"generated/adoption/acme-calendar/haxe/wordpress/hx/adoption/prototype/generated/GeneratedAcmeCalendar.hx","projectionIds":["adoption/acme-calendar/bundle"],"rootId":"generated","sizeBytes":2898,"sourceNodeIds":["adoption/acme-calendar/provider-inputs"],"sourceSpans":[{"end":{"column":1,"line":1255,"offset":46439},"path":"scripts/adoption/generate-fixture.py","sourceSha256":"5cc9d0a8c0ba440888de5a06d899002ce83bfe8fa03c752e0d6e8d21476de58b","start":{"column":1,"line":1,"offset":0},"symbol":"write_documents"}],"validatorIds":["adoption.bundle"]},{"contentSha256":"be0dd4f9b812db966d723d24784b74c073fd2ec30b971e9728474c6c8d3cb3e4","kind":"adoption.generated","ownerNodeId":"adoption/acme-calendar","path":"generated/adoption/acme-calendar/php/acme-calendar-facade.php","projectionIds":["adoption/acme-calendar/bundle"],"rootId":"generated","sizeBytes":7534,"sourceNodeIds":["adoption/acme-calendar/provider-inputs"],"sourceSpans":[{"end":{"column":1,"line":1255,"offset":46439},"path":"scripts/adoption/generate-fixture.py","sourceSha256":"5cc9d0a8c0ba440888de5a06d899002ce83bfe8fa03c752e0d6e8d21476de58b","start":{"column":1,"line":1,"offset":0},"symbol":"write_documents"}],"validatorIds":["adoption.bundle"]},{"contentSha256":"923412beee77cce43964a12358bb099ac07014bd37973df9910de3ad15b9cabd","kind":"adoption.generated","ownerNodeId":"adoption/acme-calendar","path":"generated/adoption/acme-calendar/provider/acme-calendar.2.4.1.zip","projectionIds":["adoption/acme-calendar/bundle"],"rootId":"generated","sizeBytes":1549,"sourceNodeIds":["adoption/acme-calendar/provider-inputs"],"sourceSpans":[{"end":{"column":1,"line":1255,"offset":46439},"path":"scripts/adoption/generate-fixture.py","sourceSha256":"5cc9d0a8c0ba440888de5a06d899002ce83bfe8fa03c752e0d6e8d21476de58b","start":{"column":1,"line":1,"offset":0},"symbol":"write_documents"}],"validatorIds":["adoption.bundle"]},{"contentSha256":"1e6d739f595b8f7725d2d781b3e62a15b9651d03a281558b6a50a9e1b2574ae1","kind":"adoption.generated","ownerNodeId":"adoption/acme-calendar","path":"generated/adoption/acme-calendar/review.json","projectionIds":["adoption/acme-calendar/bundle"],"rootId":"generated","sizeBytes":4785,"sourceNodeIds":["adoption/acme-calendar/provider-inputs"],"sourceSpans":[{"end":{"column":1,"line":1255,"offset":46439},"path":"scripts/adoption/generate-fixture.py","sourceSha256":"5cc9d0a8c0ba440888de5a06d899002ce83bfe8fa03c752e0d6e8d21476de58b","start":{"column":1,"line":1,"offset":0},"symbol":"write_documents"}],"validatorIds":["adoption.bundle"]}],"generator":{"cliVersion":"0.0.0-fixture","generatorId":"wordpress-hx.adoption.generator","generatorSourceSha256":"5cc9d0a8c0ba440888de5a06d899002ce83bfe8fa03c752e0d6e8d21476de58b","sdkVersion":"0.0.0-fixture","toolchainSha256":"8281edf5ded2d106bd43d1adbaf8c45c2e25ec788cbb1802a4d24c05ff014576"},"inputs":{"emissionResultSha256s":["a51063dfd677dd112fdd874b3ba420ad233e8b2c8921a07f170a4b73b3e2120d"],"generationSha256":"ac7c92c281cb65e72993fd8705f57a01346bd880a5210cbe308ddb8d17bac02d","profile":{"catalogRevision":"wp70-release/catalog-v1","catalogSha256":"d86d1d887f1a3d8894831e3ec092201ee5caba57e88f4eeff59816d22dd9aa6e","profileId":"wp70-release"},"semanticPlanSha256":"f90da3afc96bd26bcafd70ba215e0360205984799a1bd5b6ee8e3bc308a72a5d","sourceTreeSha256":"569bf6cb9a3af1d2c10d9baa7e69459925ed8dbf5226c0a4642597a9f3606002"},"locations":{"journalPath":"generated/.wphx-transactions/journal.json","lockPath":"generated/.wphx-transactions/lock","manifestPath":"generated/_GeneratedFiles.json","transactionRoot":"generated/.wphx-transactions"},"manifestDigest":"d5a97be8ff38dbd51dfbfbecb75e998878eda7b4e619ac331759affb1502d0f4","manifestDigestAlgorithm":"sha256-canonical-json-without-manifestDigest-v1","outputRoots":[{"ownershipMode":"exact-file-manifest-coexists-with-unowned","path":"generated","rootId":"generated"}],"schema":"wordpress-hx.generated-files.v1","transactionProtocol":"wordpress-hx.ownership-transaction.v1","validators":[{"configSha256":"7f32dca7b0dba5b748cdcd59fc85c42fc01057bf24f96a3dd4294bf5b2b6ac84","outcome":"passed","scope":"complete-staged-tree","tool":"ADR-015 adoption bundle validator","toolSha256":"10e678c17c687c95a5c9518109341cd6f099975eaa90ff0e654cf257544185de","validatorId":"adoption.bundle","version":"v1"}]}
