{"canonicalization":"wordpress-hx.canonical-json.v1","files":[{"contentSha256":"a40ce6912d46cc5895098759bad7865cd1614be76e7c470a346c17cd573c7d49","kind":"plugin.bootstrap.php","ownerNodeId":"module/acme-observatory","path":"build/site/acme-observatory/acme-observatory.php","projectionIds":["php/acme-observatory/bootstrap"],"rootId":"build","sizeBytes":109,"sourceNodeIds":["module/acme-observatory"],"sourceSpans":[{"end":{"column":51,"line":4,"offset":111},"path":"fixtures/semantic-plan/src/SemanticPlanFixture.hx","sourceSha256":"462105433b9a20dde949d7749c9897de0da223f86d6029d0b62fbc32ec71dd54","start":{"column":1,"line":4,"offset":61},"symbol":"fixtures.semanticplan.SemanticPlanFixture.moduleId"}],"validatorIds":["fixture.bytes"]},{"contentSha256":"5b86062c9057ccd16209b331ca3c59a429000dd37f0c46d9d666f4c1c5ce7017","kind":"plugin.support.php","ownerNodeId":"module/acme-observatory","path":"build/site/acme-observatory/stale.php","projectionIds":["php/acme-observatory/stale"],"rootId":"build","sizeBytes":121,"sourceNodeIds":["module/acme-observatory"],"sourceSpans":[{"end":{"column":51,"line":4,"offset":111},"path":"fixtures/semantic-plan/src/SemanticPlanFixture.hx","sourceSha256":"462105433b9a20dde949d7749c9897de0da223f86d6029d0b62fbc32ec71dd54","start":{"column":1,"line":4,"offset":61},"symbol":"fixtures.semanticplan.SemanticPlanFixture.moduleId"}],"validatorIds":["fixture.bytes"]}],"generator":{"cliVersion":"0.0.0-dev","generatorId":"wordpress-hx.ownership.contract-fixture","generatorSourceSha256":"33cdac8c091a1b1659c3818a0a66a092b23002f3caab72f91955777db4d58e00","sdkVersion":"0.0.0-dev","toolchainSha256":"67ea4ea71ae718c1f9dcfacaccb03273276cec3d48bac2c1628add2bcdaf7f10"},"inputs":{"emissionResultSha256s":["b12ff3e22c815b5de8c4ba2cb77dc47667ee260e26b61b4fd01144df9ae8e105"],"generationSha256":"d0ff2e98fa5ba9b2458f82eeead7a7680bd6ddb193ac9471161984a66ed3cfd8","profile":{"catalogRevision":"wp70-release/catalog-v1","catalogSha256":"530a1581d07e7509fb68f7da5b53575009ed4a94280513efd82a8c99622d9d61","profileId":"wp70-release"},"semanticPlanSha256":"f661e51923a8c1c756d2ecba6428d86c90e5fbe67efc717a18d1a293bd8b6cd2","sourceTreeSha256":"f4eb38f34bc4aa1e048dd382379b86cb6d209a3e31d482c55d31a14e59722f2c"},"locations":{"journalPath":"build/.wphx-transactions/journal.json","lockPath":"build/.wphx-transactions/lock","manifestPath":"build/_GeneratedFiles.json","transactionRoot":"build/.wphx-transactions"},"manifestDigest":"56da0ba7ccc255d24a56c386fe89d8fb8caf80265f2e2a0314cdfe01897a369d","manifestDigestAlgorithm":"sha256-canonical-json-without-manifestDigest-v1","outputRoots":[{"ownershipMode":"exact-file-manifest-coexists-with-unowned","path":"build","rootId":"build"}],"schema":"wordpress-hx.generated-files.v1","transactionProtocol":"wordpress-hx.ownership-transaction.v1","validators":[{"configSha256":"84797a5b01061bb7f5cf48271488864ce12de1330723717a7e7336bab0c7b485","outcome":"passed","scope":"complete-staged-tree","tool":"ADR-007 contract fixture","toolSha256":"33cdac8c091a1b1659c3818a0a66a092b23002f3caab72f91955777db4d58e00","validatorId":"fixture.bytes","version":"v1"}]}
