{"canonicalization":"wordpress-hx.canonical-json.v1","files":[{"contentSha256":"3ba9aba77072707b1c941b41189de32f2930db5c81046eed5e111a90287b921b","kind":"plugin.bootstrap.php","ownerNodeId":"module/acme-observatory","path":"build/site/acme-observatory/acme-observatory.php","projectionIds":["php/acme-observatory/bootstrap"],"rootId":"build","sizeBytes":109,"sourceNodeIds":["module/acme-observatory"],"sourceSpans":[{"end":{"column":51,"line":4,"offset":111},"path":"fixtures/semantic-plan/src/SemanticPlanFixture.hx","sourceSha256":"462105433b9a20dde949d7749c9897de0da223f86d6029d0b62fbc32ec71dd54","start":{"column":1,"line":4,"offset":61},"symbol":"fixtures.semanticplan.SemanticPlanFixture.moduleId"}],"validatorIds":["fixture.bytes"]},{"contentSha256":"fbf3ca8f8e243ada0a0d9026c0e14cb6a014972cf34e1f6c2bade7d11963f7f6","kind":"theme.metadata.json","ownerNodeId":"module/acme-observatory","path":"build/site/acme-observatory/theme.json","projectionIds":["metadata/acme-observatory/theme"],"rootId":"build","sizeBytes":105,"sourceNodeIds":["module/acme-observatory"],"sourceSpans":[{"end":{"column":51,"line":4,"offset":111},"path":"fixtures/semantic-plan/src/SemanticPlanFixture.hx","sourceSha256":"462105433b9a20dde949d7749c9897de0da223f86d6029d0b62fbc32ec71dd54","start":{"column":1,"line":4,"offset":61},"symbol":"fixtures.semanticplan.SemanticPlanFixture.moduleId"}],"validatorIds":["fixture.bytes"]}],"generator":{"cliVersion":"0.0.0-dev","generatorId":"wordpress-hx.ownership.contract-fixture","generatorSourceSha256":"33cdac8c091a1b1659c3818a0a66a092b23002f3caab72f91955777db4d58e00","sdkVersion":"0.0.0-dev","toolchainSha256":"fbb14d82fd01b9662ee0e6e9d783f9771a1c5b310589491c9d973da32e1e6467"},"inputs":{"emissionResultSha256s":["08740bfc1b9504bd9484b7eed4aee0b9091ec7075b39fe48a69c8870d560a287"],"generationSha256":"36e8a8660715bd1ec2ca579bca6010fc265b025417a080655290c0cf669eed7c","profile":{"catalogRevision":"wp70-release/catalog-v1","catalogSha256":"530a1581d07e7509fb68f7da5b53575009ed4a94280513efd82a8c99622d9d61","profileId":"wp70-release"},"semanticPlanSha256":"1a5324bcfa84a50a3d9631aaba11fac6a320093a169c55123aab0711249aef5b","sourceTreeSha256":"f4eb38f34bc4aa1e048dd382379b86cb6d209a3e31d482c55d31a14e59722f2c"},"locations":{"journalPath":"build/.wphx-transactions/journal.json","lockPath":"build/.wphx-transactions/lock","manifestPath":"build/_GeneratedFiles.json","transactionRoot":"build/.wphx-transactions"},"manifestDigest":"20b486383de5de78aedbb89ecb17ac76e0a278410cd9bb0eb455989958e40041","manifestDigestAlgorithm":"sha256-canonical-json-without-manifestDigest-v1","outputRoots":[{"ownershipMode":"exact-file-manifest-coexists-with-unowned","path":"build","rootId":"build"}],"schema":"wordpress-hx.generated-files.v1","transactionProtocol":"wordpress-hx.ownership-transaction.v1","validators":[{"configSha256":"84797a5b01061bb7f5cf48271488864ce12de1330723717a7e7336bab0c7b485","outcome":"passed","scope":"complete-staged-tree","tool":"ADR-007 contract fixture","toolSha256":"33cdac8c091a1b1659c3818a0a66a092b23002f3caab72f91955777db4d58e00","validatorId":"fixture.bytes","version":"v1"}]}
