{"canonicalization":"wordpress-hx.canonical-json.v1","files":[{"contentSha256":"3afd7f6947a19270ac1f1d1cd68468259a3e8cc4b2de773ad645750f59fbe215","kind":"adoption.generated","ownerNodeId":"adoption/acme-calendar","path":"generated/adoption/acme-calendar/adoption.bundle.json","projectionIds":["adoption/acme-calendar/bundle"],"rootId":"generated","sizeBytes":1290,"sourceNodeIds":["adoption/acme-calendar/provider-inputs"],"sourceSpans":[{"end":{"column":1,"line":1252,"offset":46301},"path":"scripts/adoption/generate-fixture.py","sourceSha256":"55aad8201c259e0b991f3c1b00aeb969f1323e1cb61d5a4c75de612bb57f5c4a","start":{"column":1,"line":1,"offset":0},"symbol":"write_documents"}],"validatorIds":["adoption.bundle"]},{"contentSha256":"eab9f1e5e592bee06e888ac0b08f4f0f0a2464b571e83d3680f1d3b2852900b2","kind":"adoption.generated","ownerNodeId":"adoption/acme-calendar","path":"generated/adoption/acme-calendar/browser/acme-calendar-facade.mjs","projectionIds":["adoption/acme-calendar/bundle"],"rootId":"generated","sizeBytes":6039,"sourceNodeIds":["adoption/acme-calendar/provider-inputs"],"sourceSpans":[{"end":{"column":1,"line":1252,"offset":46301},"path":"scripts/adoption/generate-fixture.py","sourceSha256":"55aad8201c259e0b991f3c1b00aeb969f1323e1cb61d5a4c75de612bb57f5c4a","start":{"column":1,"line":1,"offset":0},"symbol":"write_documents"}],"validatorIds":["adoption.bundle"]},{"contentSha256":"58156adc8a2bbc467084c676f26c1b180589dc573dc8837eb5e752ea4138fff4","kind":"adoption.generated","ownerNodeId":"adoption/acme-calendar","path":"generated/adoption/acme-calendar/capability.json","projectionIds":["adoption/acme-calendar/bundle"],"rootId":"generated","sizeBytes":2477,"sourceNodeIds":["adoption/acme-calendar/provider-inputs"],"sourceSpans":[{"end":{"column":1,"line":1252,"offset":46301},"path":"scripts/adoption/generate-fixture.py","sourceSha256":"55aad8201c259e0b991f3c1b00aeb969f1323e1cb61d5a4c75de612bb57f5c4a","start":{"column":1,"line":1,"offset":0},"symbol":"write_documents"}],"validatorIds":["adoption.bundle"]},{"contentSha256":"066f6f821bf2e7ce329fdebcff469a4775af9d6e2cf92b5c305035097c005db2","kind":"adoption.generated","ownerNodeId":"adoption/acme-calendar","path":"generated/adoption/acme-calendar/contract.json","projectionIds":["adoption/acme-calendar/bundle"],"rootId":"generated","sizeBytes":8278,"sourceNodeIds":["adoption/acme-calendar/provider-inputs"],"sourceSpans":[{"end":{"column":1,"line":1252,"offset":46301},"path":"scripts/adoption/generate-fixture.py","sourceSha256":"55aad8201c259e0b991f3c1b00aeb969f1323e1cb61d5a4c75de612bb57f5c4a","start":{"column":1,"line":1,"offset":0},"symbol":"write_documents"}],"validatorIds":["adoption.bundle"]},{"contentSha256":"59c4729d6606960a318c6517e912fb000892ffe5e26ea23d5a40fc2e38274b35","kind":"adoption.generated","ownerNodeId":"adoption/acme-calendar","path":"generated/adoption/acme-calendar/haxe/wordpress/hx/adoption/prototype/generated/GeneratedAcmeCalendar.hx","projectionIds":["adoption/acme-calendar/bundle"],"rootId":"generated","sizeBytes":2898,"sourceNodeIds":["adoption/acme-calendar/provider-inputs"],"sourceSpans":[{"end":{"column":1,"line":1252,"offset":46301},"path":"scripts/adoption/generate-fixture.py","sourceSha256":"55aad8201c259e0b991f3c1b00aeb969f1323e1cb61d5a4c75de612bb57f5c4a","start":{"column":1,"line":1,"offset":0},"symbol":"write_documents"}],"validatorIds":["adoption.bundle"]},{"contentSha256":"dd2328d67310825a1794df1f94b28d7304d7fd88aac6b8bab3212e2b4653c914","kind":"adoption.generated","ownerNodeId":"adoption/acme-calendar","path":"generated/adoption/acme-calendar/php/acme-calendar-facade.php","projectionIds":["adoption/acme-calendar/bundle"],"rootId":"generated","sizeBytes":7534,"sourceNodeIds":["adoption/acme-calendar/provider-inputs"],"sourceSpans":[{"end":{"column":1,"line":1252,"offset":46301},"path":"scripts/adoption/generate-fixture.py","sourceSha256":"55aad8201c259e0b991f3c1b00aeb969f1323e1cb61d5a4c75de612bb57f5c4a","start":{"column":1,"line":1,"offset":0},"symbol":"write_documents"}],"validatorIds":["adoption.bundle"]},{"contentSha256":"923412beee77cce43964a12358bb099ac07014bd37973df9910de3ad15b9cabd","kind":"adoption.generated","ownerNodeId":"adoption/acme-calendar","path":"generated/adoption/acme-calendar/provider/acme-calendar.2.4.1.zip","projectionIds":["adoption/acme-calendar/bundle"],"rootId":"generated","sizeBytes":1549,"sourceNodeIds":["adoption/acme-calendar/provider-inputs"],"sourceSpans":[{"end":{"column":1,"line":1252,"offset":46301},"path":"scripts/adoption/generate-fixture.py","sourceSha256":"55aad8201c259e0b991f3c1b00aeb969f1323e1cb61d5a4c75de612bb57f5c4a","start":{"column":1,"line":1,"offset":0},"symbol":"write_documents"}],"validatorIds":["adoption.bundle"]},{"contentSha256":"2cbf1e95de6b6ada60851261ac0b56754cff5f6491c13ed7872a1aef3ba31bfe","kind":"adoption.generated","ownerNodeId":"adoption/acme-calendar","path":"generated/adoption/acme-calendar/review.json","projectionIds":["adoption/acme-calendar/bundle"],"rootId":"generated","sizeBytes":4785,"sourceNodeIds":["adoption/acme-calendar/provider-inputs"],"sourceSpans":[{"end":{"column":1,"line":1252,"offset":46301},"path":"scripts/adoption/generate-fixture.py","sourceSha256":"55aad8201c259e0b991f3c1b00aeb969f1323e1cb61d5a4c75de612bb57f5c4a","start":{"column":1,"line":1,"offset":0},"symbol":"write_documents"}],"validatorIds":["adoption.bundle"]}],"generator":{"cliVersion":"0.0.0-fixture","generatorId":"wordpress-hx.adoption.generator","generatorSourceSha256":"55aad8201c259e0b991f3c1b00aeb969f1323e1cb61d5a4c75de612bb57f5c4a","sdkVersion":"0.0.0-fixture","toolchainSha256":"8281edf5ded2d106bd43d1adbaf8c45c2e25ec788cbb1802a4d24c05ff014576"},"inputs":{"emissionResultSha256s":["692c342b6e8965317da6d7da45403a0aef82bc4ab35aad44dc0b9f82f244fe6c"],"generationSha256":"8d2f6f7f9f323fc77602e8463f0708b9a9d7181a1f4e5042188733890feded2c","profile":{"catalogRevision":"wp70-release/catalog-v1","catalogSha256":"d86d1d887f1a3d8894831e3ec092201ee5caba57e88f4eeff59816d22dd9aa6e","profileId":"wp70-release"},"semanticPlanSha256":"1dd441a1584c9d2fc06ee0cb68f71973a9c36910e97418dcfaf9e8950e40d997","sourceTreeSha256":"569bf6cb9a3af1d2c10d9baa7e69459925ed8dbf5226c0a4642597a9f3606002"},"locations":{"journalPath":"generated/.wphx-transactions/journal.json","lockPath":"generated/.wphx-transactions/lock","manifestPath":"generated/_GeneratedFiles.json","transactionRoot":"generated/.wphx-transactions"},"manifestDigest":"1c68726d918ac6529c0165929e585474374a336fe75b20f7937230b1343784ff","manifestDigestAlgorithm":"sha256-canonical-json-without-manifestDigest-v1","outputRoots":[{"ownershipMode":"exact-file-manifest-coexists-with-unowned","path":"generated","rootId":"generated"}],"schema":"wordpress-hx.generated-files.v1","transactionProtocol":"wordpress-hx.ownership-transaction.v1","validators":[{"configSha256":"7f32dca7b0dba5b748cdcd59fc85c42fc01057bf24f96a3dd4294bf5b2b6ac84","outcome":"passed","scope":"complete-staged-tree","tool":"ADR-015 adoption bundle validator","toolSha256":"10e678c17c687c95a5c9518109341cd6f099975eaa90ff0e654cf257544185de","validatorId":"adoption.bundle","version":"v1"}]}
